{
  "project_root": ".",
  "roadmap_file": "ROADMAP.md",
  "retrospective_file": "docs/RETROSPECTIVE.md",
  "ledger": {
    "enabled": true,
    "directory": "history"
  },
  "source_directories": ["src", "lib"],
  "documentation_directories": ["docs", ".ai"],
  "env_check": {
    "tool_paths": {
      "dart": {
        "path": "C:\\Users\\ST-Service\\.puro\\envs\\default\\flutter\\bin\\dart.bat",
        "version_flag": "--version"
      },
      "some-tool-no-version-flag": {
        "path": "/usr/local/bin/sometool",
        "version_flag": null
      }
    }
  },
  "stop_hook": {
    "max_blocks": 2,
    "main_branch_autodetect": true,
    "main_branch_remote": "origin",
    "main_branch_probe_remote": false
  },
  "workflow_update_check": {
    "enabled": false,
    "submodule_path": ".claude/workflow-core",
    "remote": "origin",
    "branch": "main"
  }
}
